{
  "schema_version": 2,
  "id": "WORK-999",
  "record_version": "1.0.0",
  "title": "Synthetic completed Work Order",
  "status": "completed",
  "created_at": "2026-01-01T10:00:00Z",
  "contract_change": "creates",
  "constitution_version": "1.0.0",
  "affected_component_ids": ["synthetic.component"],
  "affected_contract_ids": ["contract.synthetic"],
  "affected_capability_ids": [],
  "dependency_ids": [],
  "implementation_commit_ids": ["1111111111111111111111111111111111111111"],
  "tests": [
    {
      "id": "test.synthetic",
      "command": "python3 -m unittest synthetic",
      "result": "passed"
    }
  ],
  "risks": [],
  "reversal": "Revert the synthetic implementation commit.",
  "status_history": [
    {
      "from": "approved",
      "to": "in_progress",
      "at": "2026-01-01T10:00:00Z"
    },
    {
      "from": "in_progress",
      "to": "completed",
      "at": "2026-01-01T11:00:00Z"
    }
  ]
}
